id,Phase,first,second,Nudge Description
1,New Moon,Instinct,Instinct,Seed in dark soil; sensing world through vibrations.
2,Waxing Crescent,Instinct,Training,First spark of a rising fire; turning hunches to habits.
3,First Quarter,Training,Training,Steady hammer on the anvil; rhythm in repetition.
4,Waxing Gibbous,Training,Scholarship,Artisan perfecting the blueprint; machine heartbeat.
5,Full Moon,Scholarship,Scholarship,Lighthouse in the storm; brilliant light on hidden logic.
6,Waning Gibbous,Scholarship,Aura,Sage from the mountain; truth demanding to be shared.
7,Last Quarter,Aura,Aura,Shadow at twilight; reputation is its own gravity.
8,Waning Crescent,Aura,Instinct,Dream-walker in the thinning mist; between seen and felt.
